{
  "skill": "qveris-macro-policy-monitor",
  "source_record": {
    "original_repository": "LLMQuant Skills",
    "github_url": "https://github.com/LLMQuant/skills",
    "license": "MIT",
    "adapted_components": ["llmquant-macro", "global-macro-dashboard", "fed-policy-preview"],
    "upstream_commit": "1918237467c2dff4cc97a18ebc0892dfd46e8129",
    "evaluated_at": "2026-07-24"
  },
  "controls": {
    "dry_run": true,
    "max_calls": 9,
    "max_age": { "macro": "P400D", "rates": "P120D", "market": "P7D" },
    "budget_note": "max_calls counts observed capabilities/query attempts, including retries."
  },
  "analysis": {
    "workflow": "macro_policy",
    "summary": "Static structure-only example; no observation is claimed.",
    "evidence_status": "limited",
    "as_of": "2026-07-24",
    "geography": "US",
    "window": { "start": "2024-07-24", "end": "2026-07-24", "timezone": "UTC" },
    "fallback_mode": "limited",
    "comparison_status": "snapshot_only",
    "policy_transmission": { "status": "unsupported", "reason": "No observed rates and macro evidence." },
    "curve_proxy": { "status": "unsupported", "reason": "No observed same-basis multi-tenor evidence." },
    "regime_label": { "status": "unsupported", "reason": "No observed evidence." },
    "evidence": []
  },
  "risk_notes": ["No live evidence is represented."],
  "missing_fields": ["macro_layers", "rates_layers"],
  "data_quality": { "status": "insufficient", "warnings": [], "stale_fields": [], "suppressed_fields": ["forecast", "causal_policy_transmission"] },
  "observed_call_count": 0,
  "qveris_trace": [],
  "disclaimer": "Not investment advice.",
  "suppressed_fields": ["provider", "route", "candidate", "failover", "credential"]
}
